{
  "id": "case-12-typhoon-landfall",
  "version": "0.1.0",
  "dataStatus": "placeholder",
  "meta": {
    "title": "거대한 소용돌이가 남해안을 강타",
    "subtitle": "최대 순간풍속 54m/s, 폭우와 폭풍 동시에",
    "difficulty": 3,
    "targetAudience": "중학생",
    "estimatedMinutes": 10,
    "event": {
      "date": "2022-09-06",
      "region": "남해안(제주·경남)",
      "phenomenon": "태풍 상륙"
    },
    "briefing": "9월 초, 강력한 태풍이 제주도와 남해안을 강타했다. 순간 최대 풍속이 54m/s(시속 194km)에 달하고 하루 만에 500mm 가까운 비가 내렸다. 일반 폭풍우와 다르게, 태풍은 왜 이렇게 극단적인 바람과 비를 동시에 만들어낼 수 있을까? 관측 자료를 열어 원인을 밝혀라."
  },
  "investigation": {
    "maxInvestigations": 5,
    "clues": [
      {
        "id": "clue-pressure",
        "title": "태풍 중심 기압",
        "type": "pressure-map",
        "locked": false,
        "cost": 0,
        "summary": "태풍 중심 기압이 940hPa로 매우 낮다. 주변 기압(1010hPa)과의 차이가 70hPa나 돼 강한 바람이 형성된다.",
        "data": {
          "synthetic": true,
          "time": "2022-09-06T09:00",
          "stations": [
            { "stn": 184, "name": "제주", "lat": 33.5141, "lon": 126.5296, "ps": 952.4 },
            { "stn": 159, "name": "부산", "lat": 35.1040, "lon": 129.0320, "ps": 978.6 },
            { "stn": 108, "name": "서울", "lat": 37.5714, "lon": 126.9658, "ps": 1005.2 },
            { "stn": 143, "name": "대구", "lat": 35.8851, "lon": 128.6191, "ps": 985.3 }
          ],
          "note": "태풍 중심 주변으로 급격한 기압 경도. 동심원 형태의 등압선."
        },
        "interpretationHint": "기압 차이가 클수록 바람이 강해진다. 70hPa 차이는 일반 저기압(5~10hPa 차이)과 비교해 얼마나 강한 경도일지 생각해 보자."
      },
      {
        "id": "clue-wind",
        "title": "제주도 풍속·풍향",
        "type": "wind",
        "locked": true,
        "cost": 1,
        "summary": "태풍 접근 시 풍속이 35~50m/s에 달했다. 바람 방향이 태풍 통과 전후로 반대로 바뀌었다(반시계 방향 회전).",
        "data": {
          "synthetic": true,
          "stn": 184,
          "name": "제주",
          "points": [
            { "time": "2022-09-06T00:00", "wd": 60,  "ws": 12.5 },
            { "time": "2022-09-06T02:00", "wd": 45,  "ws": 18.3 },
            { "time": "2022-09-06T04:00", "wd": 30,  "ws": 28.6 },
            { "time": "2022-09-06T06:00", "wd": 10,  "ws": 38.2 },
            { "time": "2022-09-06T08:00", "wd": 350, "ws": 47.5 },
            { "time": "2022-09-06T09:00", "wd": 320, "ws": 52.1 },
            { "time": "2022-09-06T10:00", "wd": 280, "ws": 45.8 },
            { "time": "2022-09-06T12:00", "wd": 240, "ws": 32.4 },
            { "time": "2022-09-06T14:00", "wd": 210, "ws": 20.1 },
            { "time": "2022-09-06T16:00", "wd": 190, "ws": 13.6 },
            { "time": "2022-09-06T18:00", "wd": 180, "ws": 9.2 }
          ]
        },
        "interpretationHint": "바람이 점점 강해지다가 가장 강할 때 풍향이 빠르게 바뀐다. 이것은 태풍 중심(눈)이 가장 가까이 지나갔다는 신호다."
      },
      {
        "id": "clue-rainfall",
        "title": "강수량 시계열",
        "type": "timeseries",
        "locked": true,
        "cost": 1,
        "summary": "제주에서 12시간 만에 480mm 강수. 시간당 최대 80mm를 기록했다.",
        "data": {
          "synthetic": true,
          "stn": 184,
          "name": "제주",
          "points": [
            { "time": "2022-09-06T00:00", "rn": 8.5,  "sd": 0 },
            { "time": "2022-09-06T02:00", "rn": 22.3, "sd": 0 },
            { "time": "2022-09-06T04:00", "rn": 45.8, "sd": 0 },
            { "time": "2022-09-06T06:00", "rn": 68.2, "sd": 0 },
            { "time": "2022-09-06T08:00", "rn": 79.5, "sd": 0 },
            { "time": "2022-09-06T10:00", "rn": 71.3, "sd": 0 },
            { "time": "2022-09-06T12:00", "rn": 55.4, "sd": 0 },
            { "time": "2022-09-06T14:00", "rn": 38.9, "sd": 0 },
            { "time": "2022-09-06T16:00", "rn": 22.1, "sd": 0 },
            { "time": "2022-09-06T18:00", "rn": 10.4, "sd": 0 }
          ]
        },
        "interpretationHint": "비가 가장 강할 때와 바람이 가장 강할 때가 거의 같은 시간이다. 태풍이 가져오는 비와 바람은 같은 구조에서 나온다."
      },
      {
        "id": "clue-upper-air",
        "title": "태풍 중심(눈)의 구조",
        "type": "upper-air",
        "locked": true,
        "cost": 1,
        "summary": "태풍 중심('눈') 직하는 오히려 맑고 고요하며, 눈 바깥 '눈벽'에 가장 강한 바람과 비가 집중된다.",
        "data": {
          "synthetic": true,
          "stn": 184,
          "name": "제주(태풍 눈 통과 시)",
          "time": "2022-09-06T09:30",
          "levels": [
            { "pressureHpa": 1000, "heightM": 30,   "ta": 28.5 },
            { "pressureHpa": 925,  "heightM": 760,  "ta": 24.2 },
            { "pressureHpa": 850,  "heightM": 1490, "ta": 20.8 },
            { "pressureHpa": 700,  "heightM": 3050, "ta": 12.5 },
            { "pressureHpa": 500,  "heightM": 5740, "ta": 2.3  }
          ]
        },
        "interpretationHint": "태풍 눈 안은 오히려 따뜻하다(눈 온난 구조). 이 따뜻하고 습한 공기가 중심에서 상승하며 엄청난 에너지를 방출하고, 그것이 바람과 비로 변환된다."
      },
      {
        "id": "clue-mechanism",
        "title": "태풍의 에너지 공급원",
        "type": "text",
        "locked": true,
        "cost": 1,
        "summary": "태풍은 따뜻한 열대 바다에서 증발한 수증기가 응결할 때 방출하는 잠열로 에너지를 얻는다.",
        "data": {
          "body": "태풍은 해수면 온도가 27℃ 이상인 따뜻한 바다에서 발생한다. 바다에서 증발한 대량의 수증기가 태풍 중심으로 빨려 들어가 상승하면서 응결할 때 '잠열'이라는 열에너지를 방출한다. 이 잠열이 태풍의 엔진 역할을 해 기압을 낮추고 바람을 더 강하게 만든다. 중심 기압이 낮을수록 주변과의 기압 차이가 커져 더 강한 바람이 불고, 더 많은 수증기가 공급돼 더 많은 비가 내린다. 태풍이 육지에 상륙하거나 차가운 바다로 이동하면 에너지 공급이 끊겨 약해진다."
        },
        "interpretationHint": "수증기 → 잠열 → 기압 강하 → 강풍 → 더 많은 수증기 유입: 이 순환이 태풍을 강하게 유지시킨다."
      }
    ]
  },
  "hypotheses": {
    "prompt": "태풍이 극단적인 바람과 폭우를 동시에 만들어내는 가장 핵심 원인은?",
    "options": [
      {
        "id": "h-latent-heat",
        "text": "따뜻한 바다에서 대량의 수증기가 공급되고, 수증기가 응결할 때 방출하는 잠열이 태풍의 에너지가 되어 기압을 낮추고 강풍과 폭우를 동시에 만들어낸다.",
        "verdict": "correct",
        "requiredClues": ["clue-pressure", "clue-mechanism"],
        "feedback": "정확하다. 수증기 잠열 → 기압 강하 → 강풍·폭우의 연결 고리가 태풍의 핵심이다."
      },
      {
        "id": "h-low-pressure",
        "text": "저기압이기 때문에 비가 많이 오는 것이고, 기압 차이 때문에 바람이 부는 것이다.",
        "verdict": "misconception",
        "requiredClues": ["clue-mechanism"],
        "feedback": "절반만 맞다. 저기압과 기압 차이는 맞지만, 일반 저기압도 기압 차이가 있다. 태풍이 특별히 강한 이유는 수증기 잠열이라는 지속적 에너지 공급원이 있기 때문이다."
      },
      {
        "id": "h-sea-water",
        "text": "바닷물이 직접 육지로 올라와 홍수를 만들고, 이 물이 이동하면서 바람처럼 느껴지는 것이다.",
        "verdict": "misconception",
        "requiredClues": ["clue-wind", "clue-rainfall"],
        "feedback": "태풍의 폭우는 바닷물이 아니라 수증기가 응결해 만들어진 비다. 바람은 기압 차이로 생긴 대기의 이동이지, 물의 이동이 아니다. 해수면이 높아지는 '폭풍 해일'은 별도 현상이다."
      }
    ]
  },
  "solution": {
    "mechanism": "태풍은 해수면 온도 27℃ 이상인 따뜻한 열대 바다에서 증발한 대량의 수증기로 에너지를 얻는다. 수증기가 태풍 중심으로 빨려들어 상승·응결할 때 잠열을 방출하고, 이 에너지가 기압을 낮춰(940hPa) 주변과의 기압 차이를 극대화한다. 기압 차이가 클수록 강한 바람이 불고, 강한 바람은 더 많은 수증기를 공급해 더 강한 비가 내린다. 이 자기 강화 순환이 태풍의 극단적인 바람·폭우를 만들어낸다.",
    "causalChain": [
      "해수면 온도 27℃ 이상 → 대량 수증기 증발·공급",
      "수증기 응결 시 잠열 방출 → 태풍 에너지 생성",
      "잠열로 기압 낮아짐(940hPa) → 주변과 기압 차이 70hPa",
      "강한 기압 경도 → 최대 순간 풍속 54m/s",
      "강한 상승 기류 → 12시간 480mm 폭우"
    ],
    "keyFactors": ["수증기 잠열", "낮은 중심 기압", "기압 경도력", "따뜻한 해수면 온도"]
  },
  "misconceptions": [
    {
      "id": "m-just-low",
      "trigger": "저기압이라서 비가 오고 바람이 부는 것이다.",
      "correction": "저기압인 것은 맞지만, 일반 저기압도 저기압이다. 태풍이 특별한 이유는 수증기 잠열이라는 강력한 에너지 공급원으로 기압이 960hPa 이하까지 낮아지기 때문이다."
    },
    {
      "id": "m-sea-water",
      "trigger": "바닷물이 올라와 피해를 준다.",
      "correction": "폭우는 수증기 응결로 만들어진 빗물이다. 바닷물이 해안 침수를 일으키는 '폭풍 해일'과는 다르다. 태풍의 폭우와 폭풍 해일은 별개의 현상이다."
    }
  ],
  "aiTutor": {
    "systemContext": "정답: 따뜻한 바다 수증기 → 잠열 방출 → 기압 강하(940hPa) → 기압 경도 극대화 → 강풍·폭우 자기 강화 순환. 핵심 단서는 중심 기압(940hPa)과 에너지 원리(잠열). 흔한 오개념은 (1) 단순히 저기압이라서 (2) 바닷물이 올라온다.",
    "rules": [
      "정답을 직접 말하지 말 것.",
      "기압 차이가 왜 이렇게 클 수 있는지 에너지원(잠열)으로 연결되도록 유도할 것.",
      "일반 저기압과 태풍의 차이를 에너지 공급원 유무로 구분하도록 할 것.",
      "출력은 지정 JSON 형식만 사용할 것."
    ],
    "hintLadder": [
      "제주 기압이 952hPa인데 서울은 1005hPa야. 그 차이가 50hPa 이상이야. 일반 저기압은 보통 5~10hPa 차이인데, 태풍은 왜 이렇게 기압 차이가 클까?",
      "태풍이 따뜻한 바다 위에서만 강해지고, 차가운 바다나 육지에 오면 약해지는 이유가 뭘까? 바다에서 태풍에게 뭔가를 공급해 주는 건 아닐까?",
      "수증기가 구름이 될 때(응결할 때) 열이 방출된다는 거 알아? 태풍 안에서 엄청난 양의 수증기가 응결되면 그 열이 어디로 갈까?"
    ]
  },
  "learning": {
    "concepts": ["태풍 구조(눈·눈벽)", "수증기 잠열", "기압 경도력과 바람", "태풍의 에너지원"],
    "summary": "태풍은 따뜻한 바다의 수증기를 에너지원으로 삼는 거대한 열기관이다. 수증기가 응결할 때 방출하는 잠열이 기압을 낮추고, 낮아진 기압이 더 강한 바람과 더 많은 수증기를 끌어들이는 자기 강화 순환이 태풍을 유지시킨다. 육지에 상륙하면 수증기 공급이 끊겨 약해진다.",
    "curriculumLink": "중학교 과학 - 기권과 날씨 / 태풍과 우리나라 날씨"
  },
  "dataSources": [
    {
      "name": "종관기상관측(ASOS) 시간자료 - 제주·부산·서울",
      "portal": "data.kma.go.kr",
      "retrieved": "",
      "note": "합성 예시 데이터."
    }
  ]
}
