{
  "id": "case-01-late-spring-snow",
  "version": "0.1.0",
  "dataStatus": "placeholder",
  "meta": {
    "title": "4월에 웬 함박눈?",
    "subtitle": "봄이 한창인데 산간에 눈이 쌓였다",
    "difficulty": 1,
    "targetAudience": "중학생",
    "estimatedMinutes": 8,
    "event": {
      "date": "",
      "region": "강원 산간",
      "phenomenon": "늦봄 대설"
    },
    "briefing": "4월 하순, 도시에는 벚꽃이 다 졌는데 강원 산간 마을에는 밤사이 함박눈이 내려 5cm가 쌓였다. 같은 날 가까운 평지 관측소에는 비가 내렸다. 봄인데 왜 어떤 곳엔 눈이 내렸을까? 관측 자료를 열어 단서를 모으고 원인을 밝혀라."
  },
  "investigation": {
    "maxInvestigations": 4,
    "clues": [
      {
        "id": "clue-pressure",
        "title": "지상 기압배치",
        "type": "pressure-map",
        "locked": false,
        "cost": 0,
        "summary": "한반도 북쪽에 찬 고기압이 자리 잡아 북풍 계열의 찬 공기가 남쪽으로 밀려 내려오고 있다.",
        "data": { "_placeholder": true, "note": "1단계에서 지상일기도/기압 데이터로 교체" },
        "interpretationHint": "북쪽 한기가 남하 중이라는 신호. 단, 지상만으로는 '왜 눈이냐'를 설명하지 못한다."
      },
      {
        "id": "clue-upper-air",
        "title": "상층 기온 (고층관측)",
        "type": "upper-air",
        "locked": true,
        "cost": 1,
        "summary": "상공 약 1.5km 고도의 기온이 영하로 떨어져 있다. 봄철이라도 상층에는 찬 공기가 남아 있었다.",
        "data": { "_placeholder": true, "note": "1단계에서 라디오존데(고층관측) 850hPa 기온으로 교체" },
        "interpretationHint": "이 사건의 핵심 단서. 상층이 영하면 떨어지는 강수가 녹지 않고 눈 형태를 유지할 수 있다."
      },
      {
        "id": "clue-temp-comparison",
        "title": "지역별 기온 (산간 vs 평지)",
        "type": "temp-comparison",
        "locked": true,
        "cost": 1,
        "summary": "같은 시각, 평지 관측소는 영상이지만 고도가 높은 산간 관측소는 0도 안팎이다.",
        "data": { "_placeholder": true, "note": "1단계에서 ASOS 인접 2개 지점(고도차) 기온으로 교체" },
        "interpretationHint": "고도가 높을수록 기온이 낮다. 같은 강수라도 평지는 비, 산간은 눈이 될 수 있는 이유."
      },
      {
        "id": "clue-precip-type",
        "title": "강수 형태와 적설",
        "type": "timeseries",
        "locked": true,
        "cost": 1,
        "summary": "산간 관측소에서 야간에 적설이 증가했고, 평지 관측소는 강수만 기록되고 적설은 없다.",
        "data": { "_placeholder": true, "note": "1단계에서 ASOS 적설/강수량 시계열로 교체" },
        "interpretationHint": "관측 사실 확인용. 가설이 실제 관측과 맞는지 대조한다."
      }
    ]
  },
  "hypotheses": {
    "prompt": "산간에만 눈이 내린 가장 큰 원인은 무엇일까?",
    "options": [
      {
        "id": "h-upper-cold-altitude",
        "text": "상층에 찬 공기가 남아 있었고, 산간은 고도가 높아 기온이 더 낮아 강수가 눈으로 내렸다.",
        "verdict": "correct",
        "requiredClues": ["clue-upper-air", "clue-temp-comparison"],
        "feedback": "정확하다. 상층 한기와 고도에 따른 기온 차이가 함께 작용했다."
      },
      {
        "id": "h-latitude",
        "text": "산간 마을이 더 북쪽(고위도)에 있어서 추웠기 때문이다.",
        "verdict": "misconception",
        "requiredClues": ["clue-temp-comparison"],
        "feedback": "위도 차이는 거의 없다. 두 지점의 결정적 차이는 위도가 아니라 고도다."
      },
      {
        "id": "h-warming-false",
        "text": "최근 지구온난화가 멈췄거나 거짓이라서 다시 추워졌기 때문이다.",
        "verdict": "misconception",
        "requiredClues": [],
        "feedback": "하루치 날씨와 장기 기후는 다른 이야기다. 한 번의 봄눈은 기후 추세를 뒤집지 않는다."
      }
    ]
  },
  "solution": {
    "mechanism": "봄철이라도 상층(약 850hPa)에는 찬 공기가 남아 있을 수 있다. 북쪽 고기압에서 한기가 남하한 상황에서, 떨어지는 강수가 상층의 영하층을 지나며 눈 형태를 유지한다. 평지는 지표 기온이 영상이라 도중에 녹아 비가 되지만, 고도가 높은 산간은 지표 기온도 0도 안팎이라 눈이 녹지 않고 쌓인다.",
    "causalChain": [
      "북쪽 고기압에서 찬 공기 남하",
      "상층(약 1.5km) 기온이 영하 유지",
      "고도 높은 산간은 지표 기온도 0도 안팎",
      "강수가 녹지 않고 눈으로 적설"
    ],
    "keyFactors": ["상층 기온", "고도에 따른 기온 차이", "기압배치(한기 남하)"]
  },
  "misconceptions": [
    {
      "id": "m-warming-fake",
      "trigger": "온난화 시대인데 폭설이 내렸으니 온난화는 거짓이다.",
      "correction": "하루치 날씨(weather)와 수십 년 평균인 기후(climate)는 다르다. 변동성 큰 봄철에 한 번 눈이 내린 것은 기후 추세와 별개다."
    },
    {
      "id": "m-latitude",
      "trigger": "산간이 더 추운 건 북쪽(고위도)이기 때문이다.",
      "correction": "인접한 두 지점은 위도 차이가 거의 없다. 결정적 차이는 위도가 아니라 고도(고도가 높을수록 기온이 낮다)다."
    }
  ],
  "aiTutor": {
    "systemContext": "정답: 상층 한기 + 고도에 따른 기온 차이로 산간에서만 강수가 눈으로 내림. 핵심 단서는 상층 기온(영하)과 산간/평지 기온 비교. 흔한 오개념은 (1) 온난화 부정 (2) 위도 때문이라는 오해.",
    "rules": [
      "정답을 직접 말하지 말 것.",
      "학생이 아직 열지 않은 핵심 단서(상층 기온, 지역별 기온)를 질문으로 유도할 것.",
      "오개념(위도/온난화 부정)을 감지하면 정정 질문으로 되짚을 것.",
      "출력은 지정된 JSON 형식만 사용할 것."
    ],
    "hintLadder": [
      "지상 기압배치는 봤구나. 그런데 '왜 비가 아니라 눈일까'는 지상만으로 설명이 될까?",
      "상공의 기온을 아직 안 봤어. 떨어지는 동안 공기가 차가우면 무슨 일이 생길까?",
      "같은 시각 산간과 평지의 기온을 비교해 보자. 둘의 가장 큰 차이는 뭘까?"
    ]
  },
  "learning": {
    "concepts": ["기단과 한기 남하", "고도에 따른 기온 변화", "강수의 형태(비와 눈)", "날씨와 기후의 차이"],
    "summary": "봄에도 상층에는 찬 공기가 남을 수 있고, 같은 강수라도 고도가 높은 곳에서는 눈으로 내릴 수 있다. 하루의 날씨로 장기 기후 추세를 판단할 수 없다는 점도 기억하자.",
    "curriculumLink": "중학교 과학 - 기권과 날씨"
  },
  "dataSources": [
    {
      "name": "종관기상관측(ASOS) 시간/일자료",
      "portal": "data.kma.go.kr",
      "retrieved": "",
      "note": "예시값(placeholder). 1단계에서 실제 사례일의 기온/강수/적설로 교체 예정."
    },
    {
      "name": "고층기상관측(라디오존데)",
      "portal": "data.kma.go.kr",
      "retrieved": "",
      "note": "850hPa 기온(상층 한기) 단서. 1단계에서 실제 관측값으로 교체 예정."
    }
  ]
}
