{
  "id": "case-09-west-coast-snow",
  "version": "0.1.0",
  "dataStatus": "placeholder",
  "meta": {
    "title": "서울은 맑은데 서해안만 50cm?",
    "subtitle": "같은 날, 서울은 맑고 충남 해안은 폭설",
    "difficulty": 3,
    "targetAudience": "중학생",
    "estimatedMinutes": 10,
    "event": {
      "date": "2022-12-22",
      "region": "충남·전북 서해안",
      "phenomenon": "서해안 대설(해기차)"
    },
    "briefing": "12월 하순, 서울은 맑고 쌀쌀한 날이었는데 충남 서해안(홍성·보령·군산)에는 하루 만에 50cm가 넘는 폭설이 쏟아졌다. 거리도 멀지 않은데 같은 날 왜 이렇게 강수량이 달랐을까? 관측 자료를 열어 원인을 밝혀라."
  },
  "investigation": {
    "maxInvestigations": 5,
    "clues": [
      {
        "id": "clue-pressure",
        "title": "기압배치",
        "type": "pressure-map",
        "locked": false,
        "cost": 0,
        "summary": "시베리아 고기압이 확장되어 한반도 서북쪽에서 강한 북서풍이 불고 있다.",
        "data": {
          "synthetic": true,
          "time": "2022-12-22T09:00",
          "stations": [
            { "stn": 108, "name": "서울", "lat": 37.5714, "lon": 126.9658, "ps": 1030.2 },
            { "stn": 133, "name": "대전", "lat": 36.3720, "lon": 127.3740, "ps": 1029.6 },
            { "stn": 140, "name": "군산", "lat": 35.9887, "lon": 126.7163, "ps": 1028.1 },
            { "stn": 159, "name": "부산", "lat": 35.1040, "lon": 129.0320, "ps": 1027.3 }
          ],
          "note": "시베리아 고기압 남하. 서고동저 배치로 강한 북서풍."
        },
        "interpretationHint": "시베리아에서 차가운 공기가 내려와 황해(서해)를 건너 한반도로 향하고 있다. 바람이 지나는 경로에 뭐가 있는지 생각해 보자."
      },
      {
        "id": "clue-temp-compare",
        "title": "서울 vs 서해안 적설 비교",
        "type": "timeseries",
        "locked": true,
        "cost": 1,
        "summary": "군산에서 24시간 동안 적설이 지속적으로 쌓여 53cm에 도달했다. 서울은 같은 시간 적설 거의 없음.",
        "data": {
          "synthetic": true,
          "stn": 140,
          "name": "군산",
          "points": [
            { "time": "2022-12-22T00:00", "rn": 1.5, "sd": 0 },
            { "time": "2022-12-22T02:00", "rn": 2.8, "sd": 3 },
            { "time": "2022-12-22T04:00", "rn": 3.5, "sd": 8 },
            { "time": "2022-12-22T06:00", "rn": 4.2, "sd": 14 },
            { "time": "2022-12-22T08:00", "rn": 4.0, "sd": 20 },
            { "time": "2022-12-22T10:00", "rn": 3.8, "sd": 27 },
            { "time": "2022-12-22T12:00", "rn": 3.5, "sd": 33 },
            { "time": "2022-12-22T14:00", "rn": 3.2, "sd": 39 },
            { "time": "2022-12-22T16:00", "rn": 2.8, "sd": 44 },
            { "time": "2022-12-22T18:00", "rn": 2.2, "sd": 48 },
            { "time": "2022-12-22T20:00", "rn": 1.5, "sd": 51 },
            { "time": "2022-12-22T22:00", "rn": 0.8, "sd": 53 }
          ]
        },
        "interpretationHint": "눈이 장시간 지속적으로 쌓인다는 건 눈구름이 계속 같은 지역에 유입된다는 뜻이다. 왜 서울에는 오지 않았을까?"
      },
      {
        "id": "clue-temp-air",
        "title": "기온 비교 (서울 vs 군산)",
        "type": "temp-comparison",
        "locked": true,
        "cost": 1,
        "summary": "서울과 군산 모두 영하권이지만, 군산은 폭설, 서울은 맑다. 기온 차이보다 다른 요인이 있다.",
        "data": {
          "synthetic": true,
          "series": [
            {
              "stn": 108,
              "name": "서울",
              "elevationM": 85,
              "points": [
                { "time": "2022-12-22T00:00", "ta": -8.2 },
                { "time": "2022-12-22T06:00", "ta": -9.5 },
                { "time": "2022-12-22T12:00", "ta": -5.8 },
                { "time": "2022-12-22T18:00", "ta": -7.3 }
              ]
            },
            {
              "stn": 140,
              "name": "군산(서해안)",
              "elevationM": 23,
              "points": [
                { "time": "2022-12-22T00:00", "ta": -5.4 },
                { "time": "2022-12-22T06:00", "ta": -6.1 },
                { "time": "2022-12-22T12:00", "ta": -4.2 },
                { "time": "2022-12-22T18:00", "ta": -5.0 }
              ]
            }
          ]
        },
        "interpretationHint": "두 지점 모두 영하인데 폭설은 서해안에만 내렸다. 기온이 낮다는 것만으로는 설명이 안 된다. 서해안과 서울의 결정적 차이는 뭘까?"
      },
      {
        "id": "clue-upper-air",
        "title": "상층 기온과 해기차",
        "type": "upper-air",
        "locked": true,
        "cost": 1,
        "summary": "지표 기온은 영하인데 서해 해수면 온도는 약 5℃. 이 차이(해기차)가 대류를 일으킨다.",
        "data": {
          "synthetic": true,
          "stn": 140,
          "name": "군산(레윈존데)",
          "time": "2022-12-22T09:00",
          "levels": [
            { "pressureHpa": 1000, "heightM": 20, "ta": -5.4 },
            { "pressureHpa": 925, "heightM": 780, "ta": -8.2 },
            { "pressureHpa": 850, "heightM": 1500, "ta": -11.5 },
            { "pressureHpa": 700, "heightM": 3050, "ta": -18.3 }
          ]
        },
        "interpretationHint": "해수면(약 5℃)과 그 위를 지나는 공기(영하 5~15℃)의 온도 차이가 크면, 바다 위 공기가 가열되어 상승한다. 이것이 서해안 대설의 핵심이다."
      },
      {
        "id": "clue-mechanism",
        "title": "해기차와 서해안 대설 원리",
        "type": "text",
        "locked": true,
        "cost": 1,
        "summary": "차가운 공기가 상대적으로 따뜻한 서해를 지나며 열과 수분을 얻어 눈구름이 만들어진다.",
        "data": {
          "body": "시베리아에서 내려온 매우 차가운 공기(영하 10℃ 이하)가 상대적으로 따뜻한 서해(황해, 해수면 온도 약 5℃)를 길게 지나면서 바다에서 열과 수증기를 공급받는다. 이 과정에서 하층 공기가 따뜻해지고 수분이 풍부해져 대류가 발생한다. 이렇게 만들어진 눈구름이 서해안에 상륙하며 폭설을 쏟아낸다. 이 현상을 '해기차(海氣差)에 의한 서해안 대설'이라고 한다. 서울은 서해와 멀고 바다에서 수분을 얻지 못해 맑은 날씨가 유지된다."
        },
        "interpretationHint": "서해가 '수분 공장' 역할을 한다. 바다와 공기의 온도 차이(해기차)가 클수록 눈구름이 더 강하게 발달한다."
      }
    ]
  },
  "hypotheses": {
    "prompt": "서울은 맑은데 충남 서해안에만 폭설이 내린 가장 큰 원인은?",
    "options": [
      {
        "id": "h-sea-effect",
        "text": "시베리아에서 내려온 차가운 공기가 상대적으로 따뜻한 서해를 지나며 열과 수분을 얻어 눈구름이 만들어졌고, 이것이 서해안에 상륙해 폭설을 쏟아냈다(해기차 대설).",
        "verdict": "correct",
        "requiredClues": ["clue-pressure", "clue-upper-air"],
        "feedback": "정확하다. 차가운 공기 + 상대적으로 따뜻한 서해 + 해기차 대류가 서해안 대설의 핵심이다."
      },
      {
        "id": "h-just-cold",
        "text": "기온이 더 낮은 서해안 지역이 눈이 녹지 않아 더 많이 쌓인 것이다.",
        "verdict": "misconception",
        "requiredClues": ["clue-temp-air"],
        "feedback": "기온 자료를 보면 서울이 오히려 더 춥다. 기온 차이가 아니라 서해라는 수분 공급원이 있느냐 없느냐가 결정적 차이다."
      },
      {
        "id": "h-terrain",
        "text": "서해안 지역의 낮은 지형 때문에 차가운 공기가 모여 눈이 더 많이 내렸다.",
        "verdict": "misconception",
        "requiredClues": ["clue-mechanism"],
        "feedback": "지형이 일부 영향을 주기도 하지만, 서해안 대설의 핵심은 지형이 아니라 서해가 제공하는 열과 수분이다. 바다가 없었다면 이런 폭설은 생기지 않는다."
      }
    ]
  },
  "solution": {
    "mechanism": "시베리아 고기압에서 내려온 매우 차가운 공기(영하 10℃ 이하)가 북서풍을 타고 상대적으로 따뜻한 서해(해수면 약 5℃)를 수백 km 지나면서 바다로부터 열과 수증기를 공급받는다. 해기차(海氣差)로 불안정해진 공기 덩어리가 서해안에 상륙하며 강한 눈구름으로 성장해 폭설을 만든다. 서울은 서해와 거리가 있어 수분 공급이 적어 맑은 날씨를 유지한다.",
    "causalChain": [
      "시베리아 고기압 남하 → 강한 북서풍",
      "차가운 공기(영하)가 서해(해수면 약 5℃) 위를 통과",
      "해기차로 하층 공기 가열·수분 공급 → 대류 발생",
      "눈구름이 서해안 상륙 → 폭설"
    ],
    "keyFactors": ["해기차(海氣差)", "서해(황해) 수분 공급", "시베리아 한기", "북서풍"]
  },
  "misconceptions": [
    {
      "id": "m-temperature",
      "trigger": "기온이 낮은 서해안에 눈이 더 많이 쌓인 것이다.",
      "correction": "서울이 서해안보다 오히려 더 차가웠다. 폭설의 원인은 기온 차이가 아니라 서해라는 수분 공급원이다."
    },
    {
      "id": "m-terrain",
      "trigger": "서해안의 지형이 눈을 만들었다.",
      "correction": "지형성 강수는 산악 지형에서 공기가 강제 상승할 때 생긴다. 이 사례는 평평한 서해안에서 바다 위 대류로 만들어진 눈이다."
    }
  ],
  "aiTutor": {
    "systemContext": "정답: 시베리아 한기 + 서해 해기차(차가운 공기가 따뜻한 바다 위를 지나며 수분·열 획득) → 서해안 대설. 핵심 단서는 기압배치(북서풍), 해기차(상층기온과 해수면 온도 차이). 흔한 오개념은 (1) 기온이 낮아서 (2) 지형 때문에.",
    "rules": [
      "정답을 직접 말하지 말 것.",
      "서울과 서해안의 결정적 차이(서해 존재 여부)를 질문으로 유도할 것.",
      "기온 비교 후 서울이 더 추운데 왜 눈이 안 왔는지 되짚을 것.",
      "출력은 지정 JSON 형식만 사용할 것."
    ],
    "hintLadder": [
      "서울과 군산의 기온을 비교해 봤어? 더 추운 쪽은 어디지? 그런데 눈은 어디에 내렸지?",
      "북서풍이 불 때 그 바람이 한반도 도달 전에 무엇을 지나쳐 오는지 생각해 봐. 서해는 겨울에 어떤 온도일까?",
      "차가운 공기가 따뜻한 바다 위를 길게 지나면 공기에 어떤 변화가 생길까?"
    ]
  },
  "learning": {
    "concepts": ["해기차(海氣差)", "서해안 대설 메커니즘", "시베리아 고기압", "호수 효과(lake effect)"],
    "summary": "겨울철 시베리아 한기가 북서풍을 타고 서해를 지날 때, 따뜻한 바다에서 열과 수분을 얻어 눈구름이 만들어진다. 이것이 서해안 대설이다. 서해 해수면과 대기 온도 차이(해기차)가 클수록 눈구름이 강하게 발달한다.",
    "curriculumLink": "중학교 과학 - 기권과 날씨 / 우리나라 기후 특성"
  },
  "dataSources": [
    {
      "name": "종관기상관측(ASOS) 시간자료 - 군산·서울",
      "portal": "data.kma.go.kr",
      "retrieved": "",
      "note": "합성 예시 데이터."
    }
  ]
}
