{
  "id": "case-02-yeongdong-foehn",
  "version": "0.1.0",
  "dataStatus": "placeholder",
  "meta": {
    "title": "한겨울에 강릉만 봄날?",
    "subtitle": "서울은 영하인데 동해안은 20도 가까이",
    "difficulty": 2,
    "targetAudience": "중학생",
    "estimatedMinutes": 9,
    "event": { "date": "", "region": "강원 영동(강릉)", "phenomenon": "겨울 이상고온(푄)" },
    "briefing": "1월의 어느 날, 서울과 영서지방은 영하의 추위였는데 동해안 강릉은 한낮에 기온이 20℃ 가까이 치솟았다. 같은 강원도인데 왜 영동만 이렇게 따뜻했을까? 관측 자료를 열어 원인을 밝혀라."
  },
  "investigation": {
    "maxInvestigations": 4,
    "clues": [
      {
        "id": "clue-wind",
        "title": "강릉의 바람",
        "type": "wind",
        "locked": false,
        "cost": 0,
        "summary": "강릉에 서~남서풍이 강하게 불고 있다. 태백산맥 쪽에서 넘어온 바람이다.",
        "data": { "_placeholder": true, "note": "1단계에서 강릉 ASOS 풍향·풍속으로 교체" },
        "interpretationHint": "어느 쪽에서 부는 바람인지가 핵심. 산을 넘어 내려온 바람이다."
      },
      {
        "id": "clue-temp-east-west",
        "title": "영동 vs 영서 기온",
        "type": "temp-comparison",
        "locked": true,
        "cost": 1,
        "summary": "같은 시각, 영동(강릉)은 영상 십수 도인데 영서(원주)는 영하다.",
        "data": { "_placeholder": true, "note": "1단계에서 강릉·원주 ASOS 기온으로 교체" },
        "interpretationHint": "같은 위도인데 산맥을 사이에 두고 기온이 크게 갈린다."
      },
      {
        "id": "clue-pressure",
        "title": "기압배치",
        "type": "pressure-map",
        "locked": true,
        "cost": 1,
        "summary": "서쪽 기압이 높고 동쪽이 낮은 '서고동저'로 강한 서풍이 분다.",
        "data": { "_placeholder": true, "note": "1단계에서 ASOS 해면기압으로 교체" },
        "interpretationHint": "기압 차이가 서풍을 만들고, 그 바람이 태백산맥을 넘는다."
      },
      {
        "id": "clue-terrain",
        "title": "태백산맥과 건조한 공기",
        "type": "text",
        "locked": true,
        "cost": 1,
        "summary": "강릉의 습도가 20%대로 매우 낮다. 산을 넘어온 바람이 건조하다.",
        "data": { "body": "서풍이 태백산맥을 오를 때 수증기가 비·눈으로 떨어져 공기가 건조해진다. 산을 넘어 영동으로 내려오면 고도가 낮아지며 단열적으로 데워져, 고온·건조한 바람이 되어 도착한다." },
        "interpretationHint": "건조함은 '산을 넘어온 바람'의 증거다."
      }
    ]
  },
  "hypotheses": {
    "prompt": "한겨울에 영동(강릉)만 따뜻했던 가장 큰 원인은?",
    "options": [
      {
        "id": "h-foehn",
        "text": "서풍 계열이 태백산맥을 넘으며 데워지는 푄 현상으로 영동이 고온건조해졌다.",
        "verdict": "correct",
        "requiredClues": ["clue-wind", "clue-temp-east-west"],
        "feedback": "정확하다. 바람의 방향과 영동·영서 기온차가 함께 가리키는 답이다."
      },
      {
        "id": "h-latitude",
        "text": "강릉이 더 남쪽(저위도)이라 원래 따뜻하기 때문이다.",
        "verdict": "misconception",
        "requiredClues": ["clue-temp-east-west"],
        "feedback": "강릉과 영서는 위도 차이가 거의 없다. 결정적 차이는 위도가 아니라 바람과 지형이다."
      },
      {
        "id": "h-sea",
        "text": "따뜻한 동해 바닷물이 공기를 데웠기 때문이다.",
        "verdict": "misconception",
        "requiredClues": ["clue-wind"],
        "feedback": "겨울 동해가 공기를 한낮 20℃까지 끌어올리긴 어렵고, 바람은 바다가 아니라 산 쪽(서쪽)에서 불어왔다."
      }
    ]
  },
  "solution": {
    "mechanism": "서풍 계열의 바람이 태백산맥을 넘는 과정에서 풍상측(영서)에서는 수증기를 잃고, 산을 넘어 영동으로 내려오며 단열적으로 데워진다(푄 현상). 그 결과 영동은 같은 날에도 고온·건조한 날씨가 된다.",
    "causalChain": [
      "서풍 계열의 바람이 강하게 유입",
      "태백산맥을 오르며 수증기가 비·눈으로 떨어져 공기가 건조해짐",
      "산을 넘어 내려오며 고도가 낮아져 단열적으로 데워짐",
      "영동에 고온·건조한 바람으로 도착"
    ],
    "keyFactors": ["바람 방향(서풍)", "태백산맥 지형", "단열 승온", "영동·영서 기온차"]
  },
  "misconceptions": [
    { "id": "m-latitude", "trigger": "강릉이 남쪽이라 따뜻하다.", "correction": "강릉과 영서는 위도가 거의 같다. 차이는 바람과 산맥 지형이다." },
    { "id": "m-sea", "trigger": "동해가 데워줘서 따뜻하다.", "correction": "바람은 서쪽(산 쪽)에서 불어왔고, 겨울 바다가 그렇게 빠르게 데우지 못한다." }
  ],
  "aiTutor": {
    "systemContext": "정답: 서풍 계열이 태백산맥을 넘으며 데워지는 푄 현상으로 영동(강릉) 고온건조. 핵심 단서는 풍향(서풍)과 영동·영서 기온차. 흔한 오개념은 (1) 위도 (2) 동해 영향.",
    "rules": [
      "정답을 직접 말하지 말 것.",
      "풍향과 영동·영서 기온차 단서를 질문으로 유도할 것.",
      "위도/바다 오개념을 감지하면 되짚을 것.",
      "출력은 지정 JSON 형식만."
    ],
    "hintLadder": [
      "바람이 어느 쪽에서 부는지 봤어? 그 방향에 뭐가 있지?",
      "같은 시각 영동과 영서의 기온을 비교해 보자. 둘 사이엔 뭐가 있을까?",
      "산을 넘어 내려온 공기는 왜 건조하고 따뜻할까?"
    ]
  },
  "learning": {
    "concepts": ["푄 현상", "산맥을 넘는 바람의 단열 변화", "지형이 만드는 지역 기후 차이"],
    "summary": "바람이 산을 넘으면 풍하측은 고온·건조해진다(푄). 늦봄 영서를 덥히는 '높새바람'도 방향만 반대일 뿐 같은 원리다.",
    "curriculumLink": "중학교 과학 - 기권과 날씨 / 우리나라의 기후"
  },
  "dataSources": [
    { "name": "종관기상관측(ASOS) 시간자료 - 강릉·원주", "portal": "data.kma.go.kr", "retrieved": "", "note": "예시값(placeholder). 1단계에서 실제 사례일 기온·풍향·기압으로 교체." }
  ]
}
