{
  "id": "case-10-siberian-cold-wave",
  "version": "0.1.0",
  "dataStatus": "placeholder",
  "meta": {
    "title": "서울 영하 15도, 왜 이렇게 추울까?",
    "subtitle": "시베리아 한기가 한반도를 덮쳤다",
    "difficulty": 1,
    "targetAudience": "중학생",
    "estimatedMinutes": 8,
    "event": {
      "date": "2023-01-24",
      "region": "전국",
      "phenomenon": "시베리아 한파"
    },
    "briefing": "1월 하순, 서울 기온이 영하 15도까지 떨어지며 체감온도는 영하 25도를 기록했다. 일주일 전만 해도 영하 5도 수준이었는데 갑자기 왜 이렇게 극심한 추위가 찾아온 걸까? 관측 자료를 열어 원인을 밝혀라."
  },
  "investigation": {
    "maxInvestigations": 4,
    "clues": [
      {
        "id": "clue-pressure",
        "title": "기압배치",
        "type": "pressure-map",
        "locked": false,
        "cost": 0,
        "summary": "시베리아 쪽에 매우 강한 고기압(1055hPa 이상)이 자리 잡고 한반도 동쪽에 저기압이 있어 강한 북서풍이 형성됐다.",
        "data": {
          "synthetic": true,
          "time": "2023-01-24T09:00",
          "stations": [
            { "stn": 108, "name": "서울", "lat": 37.5714, "lon": 126.9658, "ps": 1034.8 },
            { "stn": 159, "name": "부산", "lat": 35.1040, "lon": 129.0320, "ps": 1030.2 },
            { "stn": 90,  "name": "속초", "lat": 38.2509, "lon": 128.5647, "ps": 1028.6 }
          ],
          "note": "북고남저·서고동저 복합 배치. 시베리아 고기압이 강하게 확장."
        },
        "interpretationHint": "기압이 높은 곳에서 낮은 곳으로 바람이 분다. 시베리아가 1055hPa라면 그곳 공기는 어떤 성질을 가졌을까?"
      },
      {
        "id": "clue-wind",
        "title": "풍향·풍속",
        "type": "wind",
        "locked": true,
        "cost": 1,
        "summary": "북서풍이 초속 8~12m로 강하게 지속됐다. 체감온도는 기온보다 10도 이상 낮게 느껴진다.",
        "data": {
          "synthetic": true,
          "stn": 108,
          "name": "서울",
          "points": [
            { "time": "2023-01-24T00:00", "wd": 320, "ws": 9.5 },
            { "time": "2023-01-24T03:00", "wd": 315, "ws": 10.2 },
            { "time": "2023-01-24T06:00", "wd": 310, "ws": 11.0 },
            { "time": "2023-01-24T09:00", "wd": 315, "ws": 11.8 },
            { "time": "2023-01-24T12:00", "wd": 320, "ws": 12.1 },
            { "time": "2023-01-24T15:00", "wd": 315, "ws": 11.5 },
            { "time": "2023-01-24T18:00", "wd": 310, "ws": 10.8 },
            { "time": "2023-01-24T21:00", "wd": 315, "ws": 9.8 }
          ]
        },
        "interpretationHint": "강한 북서풍은 시베리아에서 직접 내려온 바람이다. 바람이 강할수록 체감온도는 더 낮아진다."
      },
      {
        "id": "clue-temp",
        "title": "서울 기온 변화 (1주일)",
        "type": "temp-comparison",
        "locked": true,
        "cost": 1,
        "summary": "1월 17일 영하 5도였던 기온이 1월 24일 영하 15도까지 급격히 떨어졌다. 불과 1주일 만의 변화다.",
        "data": {
          "synthetic": true,
          "series": [
            {
              "stn": 108,
              "name": "서울(일 최저기온)",
              "elevationM": 85,
              "points": [
                { "time": "2023-01-17T00:00", "ta": -4.8 },
                { "time": "2023-01-18T00:00", "ta": -5.2 },
                { "time": "2023-01-19T00:00", "ta": -6.1 },
                { "time": "2023-01-20T00:00", "ta": -7.8 },
                { "time": "2023-01-21T00:00", "ta": -9.5 },
                { "time": "2023-01-22T00:00", "ta": -11.3 },
                { "time": "2023-01-23T00:00", "ta": -13.2 },
                { "time": "2023-01-24T00:00", "ta": -14.8 }
              ]
            }
          ]
        },
        "interpretationHint": "기온이 서서히 떨어졌다는 건 어떤 공기 덩어리가 조금씩 다가오다가 완전히 덮었다는 신호다."
      },
      {
        "id": "clue-upper-air",
        "title": "상층 기온",
        "type": "upper-air",
        "locked": true,
        "cost": 1,
        "summary": "지표부터 상층까지 전층이 극도로 차갑다. 시베리아 기단이 한반도 전체를 덮었다.",
        "data": {
          "synthetic": true,
          "stn": 108,
          "name": "서울(레윈존데)",
          "time": "2023-01-24T09:00",
          "levels": [
            { "pressureHpa": 1000, "heightM": 100, "ta": -14.2 },
            { "pressureHpa": 925, "heightM": 800, "ta": -18.5 },
            { "pressureHpa": 850, "heightM": 1520, "ta": -22.8 },
            { "pressureHpa": 700, "heightM": 3080, "ta": -30.4 }
          ]
        },
        "interpretationHint": "지표뿐 아니라 상층도 영하 20~30도다. 이는 하층 일부만 차가운 '지표 냉각'과 다르다. 기단 전체가 교체된 것이다."
      }
    ]
  },
  "hypotheses": {
    "prompt": "서울 기온이 영하 15도까지 급격히 떨어진 가장 큰 원인은?",
    "options": [
      {
        "id": "h-siberian-airmass",
        "text": "시베리아 고기압이 강하게 확장하면서 영하 수십 도의 찬 시베리아 기단이 강한 북서풍을 타고 한반도를 덮쳤기 때문이다.",
        "verdict": "correct",
        "requiredClues": ["clue-pressure", "clue-wind"],
        "feedback": "정확하다. 강한 시베리아 고기압 → 북서풍 → 한기 직접 유입이 한파의 경로다."
      },
      {
        "id": "h-night-cooling",
        "text": "맑은 밤 동안 지표 복사 냉각이 심해서 기온이 크게 떨어진 것이다.",
        "verdict": "misconception",
        "requiredClues": ["clue-upper-air"],
        "feedback": "복사 냉각은 지표 부근만 식힌다. 상층 기온을 보면 고도 3km에서도 영하 30도다. 지표만의 문제가 아니라 기단 전체가 교체됐다는 뜻이다."
      },
      {
        "id": "h-global-warming-pause",
        "text": "최근 지구온난화가 거짓으로 밝혀져서 다시 추워진 것이다.",
        "verdict": "misconception",
        "requiredClues": [],
        "feedback": "한파는 매년 반복되는 겨울 기상 현상이다. 하나의 한파 사례로 수십 년 기후 추세를 판단할 수 없다. 이 한파의 원인은 시베리아 기단이지 기후 추세 변화가 아니다."
      }
    ]
  },
  "solution": {
    "mechanism": "시베리아 대륙에 1055hPa를 넘는 강한 고기압이 형성되어 남쪽으로 확장했다. 이 고기압에서 내려온 영하 수십 도의 차가운 시베리아 기단이 강한 북서풍을 타고 한반도를 직접 덮으며 기온이 급격히 하강했다. 지표뿐 아니라 상층까지 극도로 차가운 공기로 교체된 것이 이번 한파의 핵심이다.",
    "causalChain": [
      "시베리아 대륙에 강한 고기압 형성(1055hPa 이상)",
      "고기압 확장 → 한반도로 강한 북서풍 유입",
      "영하 수십 도의 시베리아 기단이 한반도 전체를 덮음",
      "지표~상층 전층 한기 → 기온 영하 15도 이하로 급강하"
    ],
    "keyFactors": ["시베리아 고기압", "기단 교체", "북서풍", "한기 직접 유입"]
  },
  "misconceptions": [
    {
      "id": "m-radiation",
      "trigger": "맑은 밤에 복사 냉각이 심해서 추워진 것이다.",
      "correction": "복사 냉각은 지표 부근을 식히지만, 상층 3km에서 영하 30도가 된 것은 설명할 수 없다. 이것은 기단 자체가 시베리아 한기로 교체된 것이다."
    },
    {
      "id": "m-climate",
      "trigger": "온난화가 거짓이라서 추워진 것이다.",
      "correction": "한파는 해마다 찾아오는 계절 현상이다. 장기 기후 추세(수십 년 평균)와 하루하루의 날씨는 다른 이야기다."
    }
  ],
  "aiTutor": {
    "systemContext": "정답: 시베리아 고기압 확장 → 강한 북서풍 → 시베리아 기단(한기)이 한반도 전체 덮음 → 한파. 핵심 단서는 기압배치(시베리아 고기압)와 상층 기온(전층 극한). 흔한 오개념은 (1) 복사 냉각과 혼동 (2) 기후 온난화와 혼동.",
    "rules": [
      "정답을 직접 말하지 말 것.",
      "기압배치에서 바람의 발원지를 질문으로 유도할 것.",
      "복사 냉각과 기단 교체의 차이를 상층 기온 자료로 설명하도록 유도할 것.",
      "출력은 지정 JSON 형식만 사용할 것."
    ],
    "hintLadder": [
      "기압 배치를 보면 높은 기압이 어느 쪽에 있지? 그쪽에서 불어온 바람은 어디를 지나쳐 온 걸까?",
      "상층 기온을 봤어? 3km 높이에서도 영하 30도야. 이게 단순히 밤에 식은 것과 어떻게 다를까?",
      "기온이 1주일 동안 어떻게 변했지? 서서히 내려갔다면, 어떤 공기 덩어리가 점점 다가왔다는 뜻은 아닐까?"
    ]
  },
  "learning": {
    "concepts": ["시베리아 기단", "기단과 한파", "기압 배치와 바람", "체감온도"],
    "summary": "한파는 시베리아의 차가운 기단(공기 덩어리)이 강한 고기압과 함께 한반도까지 내려올 때 발생한다. 지표만 차가운 복사 냉각과 달리, 기단 교체는 하늘 높은 곳까지 전층이 극도로 차가워진다. 강한 북서풍은 체감온도를 실제 기온보다 10도 이상 낮게 만든다.",
    "curriculumLink": "중학교 과학 - 기권과 날씨 / 기단과 전선"
  },
  "dataSources": [
    {
      "name": "종관기상관측(ASOS) 시간자료 - 서울",
      "portal": "data.kma.go.kr",
      "retrieved": "",
      "note": "합성 예시 데이터."
    }
  ]
}
