{
  "id": "case-04-autumn-fog",
  "version": "0.1.0",
  "dataStatus": "placeholder",
  "meta": {
    "title": "가을 새벽에 짙은 안개?",
    "subtitle": "비도 안 왔는데 앞이 안 보일 정도로 안개가 꼈다",
    "difficulty": 1,
    "targetAudience": "중학생",
    "estimatedMinutes": 8,
    "event": {
      "date": "2023-10-15",
      "region": "수도권/경기",
      "phenomenon": "복사 안개"
    },
    "briefing": "10월 중순, 맑고 바람 한 점 없는 가을 새벽에 수도권 일대에 짙은 안개가 깔렸다. 전날 비도 없었고, 구름도 거의 없었는데 왜 갑자기 이렇게 짙은 안개가 생겼을까? 관측 자료를 열어 원인을 밝혀라."
  },
  "investigation": {
    "maxInvestigations": 4,
    "clues": [
      {
        "id": "clue-temp",
        "title": "새벽 기온 변화",
        "type": "temp-comparison",
        "locked": false,
        "cost": 0,
        "summary": "자정 이후 기온이 빠르게 떨어져 새벽 4~5시경 이슬점(약 10℃)에 도달했다.",
        "data": {
          "synthetic": true,
          "series": [
            {
              "stn": 108,
              "name": "서울(도심)",
              "elevationM": 85,
              "points": [
                { "time": "2023-10-15T00:00", "ta": 17.2 },
                { "time": "2023-10-15T01:00", "ta": 15.8 },
                { "time": "2023-10-15T02:00", "ta": 14.3 },
                { "time": "2023-10-15T03:00", "ta": 13.0 },
                { "time": "2023-10-15T04:00", "ta": 11.5 },
                { "time": "2023-10-15T05:00", "ta": 10.2 },
                { "time": "2023-10-15T06:00", "ta": 9.8 },
                { "time": "2023-10-15T07:00", "ta": 10.4 },
                { "time": "2023-10-15T08:00", "ta": 12.1 },
                { "time": "2023-10-15T09:00", "ta": 14.5 },
                { "time": "2023-10-15T10:00", "ta": 17.0 },
                { "time": "2023-10-15T11:00", "ta": 19.2 },
                { "time": "2023-10-15T12:00", "ta": 20.8 }
              ]
            },
            {
              "stn": 119,
              "name": "수원(교외)",
              "elevationM": 34,
              "points": [
                { "time": "2023-10-15T00:00", "ta": 15.6 },
                { "time": "2023-10-15T01:00", "ta": 13.9 },
                { "time": "2023-10-15T02:00", "ta": 12.2 },
                { "time": "2023-10-15T03:00", "ta": 10.8 },
                { "time": "2023-10-15T04:00", "ta": 9.5 },
                { "time": "2023-10-15T05:00", "ta": 8.8 },
                { "time": "2023-10-15T06:00", "ta": 8.4 },
                { "time": "2023-10-15T07:00", "ta": 9.2 },
                { "time": "2023-10-15T08:00", "ta": 11.5 },
                { "time": "2023-10-15T09:00", "ta": 14.2 },
                { "time": "2023-10-15T10:00", "ta": 17.1 },
                { "time": "2023-10-15T11:00", "ta": 19.5 },
                { "time": "2023-10-15T12:00", "ta": 21.3 }
              ]
            }
          ]
        },
        "interpretationHint": "밤새 기온이 계속 내려가 새벽에 이슬점에 근접했다. 이때 수증기 응결이 시작된다."
      },
      {
        "id": "clue-wind",
        "title": "새벽 바람",
        "type": "wind",
        "locked": true,
        "cost": 1,
        "summary": "자정부터 일출 전까지 풍속이 1m/s 미만으로 거의 정지 상태였다.",
        "data": {
          "synthetic": true,
          "stn": 108,
          "name": "서울",
          "points": [
            { "time": "2023-10-15T00:00", "wd": 90, "ws": 0.8 },
            { "time": "2023-10-15T01:00", "wd": 80, "ws": 0.5 },
            { "time": "2023-10-15T02:00", "wd": 100, "ws": 0.4 },
            { "time": "2023-10-15T03:00", "wd": 90, "ws": 0.3 },
            { "time": "2023-10-15T04:00", "wd": 70, "ws": 0.3 },
            { "time": "2023-10-15T05:00", "wd": 60, "ws": 0.2 },
            { "time": "2023-10-15T06:00", "wd": 50, "ws": 0.2 },
            { "time": "2023-10-15T07:00", "wd": 90, "ws": 0.5 },
            { "time": "2023-10-15T08:00", "wd": 120, "ws": 1.2 },
            { "time": "2023-10-15T09:00", "wd": 150, "ws": 2.1 },
            { "time": "2023-10-15T10:00", "wd": 180, "ws": 3.0 },
            { "time": "2023-10-15T11:00", "wd": 200, "ws": 3.5 },
            { "time": "2023-10-15T12:00", "wd": 210, "ws": 3.8 }
          ]
        },
        "interpretationHint": "바람이 없어야 지표 부근의 냉각된 공기가 쌓이고 안개가 형성된다. 바람이 강하면 공기가 섞여 안개가 생기지 않는다."
      },
      {
        "id": "clue-pressure",
        "title": "기압배치",
        "type": "pressure-map",
        "locked": true,
        "cost": 1,
        "summary": "이동성 고기압이 한반도 위에 자리 잡아 하늘이 맑고 바람이 잔잔하다.",
        "data": {
          "synthetic": true,
          "time": "2023-10-15T03:00",
          "stations": [
            { "stn": 108, "name": "서울", "lat": 37.5714, "lon": 126.9658, "ps": 1024.8 },
            { "stn": 119, "name": "수원", "lat": 37.2636, "lon": 127.0286, "ps": 1024.9 },
            { "stn": 159, "name": "부산", "lat": 35.1040, "lon": 129.0320, "ps": 1023.6 }
          ],
          "note": "이동성 고기압 정체. 맑은 밤 → 복사 냉각 극대화."
        },
        "interpretationHint": "구름이 없는 맑은 밤에 지표 열이 우주로 빠져나간다(복사 냉각). 고기압 아래 바람도 잔잔해 냉각 효과가 극대화된다."
      },
      {
        "id": "clue-mechanism",
        "title": "복사 안개 원리",
        "type": "text",
        "locked": true,
        "cost": 1,
        "summary": "맑은 밤 → 지표 복사 냉각 → 기온 이슬점 도달 → 수증기 응결 → 복사안개 형성.",
        "data": {
          "body": "구름이 없는 맑은 밤에는 지표가 적외선 복사로 열을 우주로 방출해 빠르게 식는다. 바람이 잔잔하면 차가운 공기가 지표 근처에 쌓이고, 기온이 이슬점 이하로 내려가면 수증기가 응결되어 안개 입자가 된다. 이것을 '복사안개(radiation fog)'라고 한다. 일출 후 햇빛이 들어오면 기온이 올라 안개가 사라진다."
        },
        "interpretationHint": "복사 냉각 + 고요한 바람 = 복사안개의 두 핵심 조건."
      }
    ]
  },
  "hypotheses": {
    "prompt": "맑은 가을 새벽에 짙은 안개가 생긴 가장 큰 원인은?",
    "options": [
      {
        "id": "h-radiation-fog",
        "text": "맑은 밤에 지표가 복사 냉각으로 빠르게 식고, 바람이 없어 기온이 이슬점 이하로 떨어지며 수증기가 응결해 안개가 생겼다.",
        "verdict": "correct",
        "requiredClues": ["clue-temp", "clue-wind"],
        "feedback": "정확하다. 맑은 하늘 + 무풍 + 복사 냉각이 복사안개의 세 조건이다."
      },
      {
        "id": "h-sea-moisture",
        "text": "서해나 동해에서 따뜻한 수증기가 날아와 수도권에 안개를 만들었다.",
        "verdict": "misconception",
        "requiredClues": ["clue-wind"],
        "feedback": "바람이 거의 없어 먼 바다에서 수증기가 운반되기 어렵고, 이 안개는 '이동'이 아니라 그 자리에서 '생성'된 것이다."
      },
      {
        "id": "h-pollution",
        "text": "공장·차량 배기가스와 수증기가 결합해 스모그처럼 안개가 생겼다.",
        "verdict": "misconception",
        "requiredClues": [],
        "feedback": "스모그(연무)와 안개는 다르다. 이 사례는 대기오염 없이도 기온·바람 조건만으로 형성되는 자연 현상이다."
      }
    ]
  },
  "solution": {
    "mechanism": "맑은 가을밤에 구름 없이 지표 복사가 활발해 기온이 빠르게 떨어졌다. 바람이 거의 없어 지표 부근에 차가운 공기가 쌓이고, 기온이 이슬점 아래로 내려가면서 수증기가 응결해 복사안개가 형성됐다. 일출 후 태양 복사로 기온이 오르면 안개는 자연스럽게 소산된다.",
    "causalChain": [
      "이동성 고기압 정체 → 맑은 하늘",
      "구름 없는 밤 → 지표 복사 냉각 활발",
      "무풍 조건 → 냉각 공기가 지표에 축적",
      "기온이 이슬점 이하 → 수증기 응결 → 복사안개 형성"
    ],
    "keyFactors": ["복사 냉각", "무풍 조건", "이슬점 도달"]
  },
  "misconceptions": [
    {
      "id": "m-sea",
      "trigger": "바다에서 수증기가 날아와 안개가 생겼다.",
      "correction": "복사안개는 외부에서 수증기가 공급되는 것이 아니라, 그 자리의 공기가 식으면서 이미 있던 수증기가 응결하는 것이다."
    },
    {
      "id": "m-smog",
      "trigger": "배기가스 때문에 안개처럼 뿌옇게 된 것이다.",
      "correction": "스모그는 오염 물질과 수증기의 혼합물이지만, 복사안개는 순수하게 기상 조건(냉각+무풍)으로 생긴다."
    }
  ],
  "aiTutor": {
    "systemContext": "정답: 복사 냉각 + 무풍 조건으로 이슬점 도달 → 복사안개 형성. 핵심 단서는 새벽 기온 하강(이슬점 도달)과 풍속이 0에 가까운 상태. 흔한 오개념은 (1) 바다 수증기 이동 (2) 배기가스.",
    "rules": [
      "정답을 직접 말하지 말 것.",
      "기온이 이슬점 이하로 떨어지는 과정을 질문으로 유도할 것.",
      "오개념(바다/스모그)을 감지하면 질문으로 되짚을 것.",
      "출력은 지정 JSON 형식만 사용할 것."
    ],
    "hintLadder": [
      "새벽에 기온이 많이 떨어졌지? 그 기온이 이슬점(수증기가 응결하는 온도)에 얼마나 가까워졌을까?",
      "바람 자료를 봤어? 바람이 강하면 안개가 생길 수 있을까, 아니면 없어질까?",
      "맑은 밤에 지표에서는 어떤 일이 일어나고 있을까? 구름이 있을 때와 없을 때 뭐가 다를까?"
    ]
  },
  "learning": {
    "concepts": ["복사 냉각", "이슬점", "복사안개 형성 조건", "이동성 고기압"],
    "summary": "맑고 바람 없는 가을·겨울 새벽에 지표가 빠르게 식으면 복사안개가 생긴다. 일출 후 기온이 오르면 자연 소산된다. 바람과 구름은 복사안개를 막는 두 가지 방어막이다.",
    "curriculumLink": "중학교 과학 - 기권과 날씨 / 수증기와 구름"
  },
  "dataSources": [
    {
      "name": "종관기상관측(ASOS) 시간자료 - 서울·수원",
      "portal": "data.kma.go.kr",
      "retrieved": "",
      "note": "합성 예시 데이터."
    }
  ]
}
