{
  "id": "case-08-spring-yellow-dust",
  "version": "0.1.0",
  "dataStatus": "placeholder",
  "meta": {
    "title": "하늘이 노랗게 물든 봄날",
    "subtitle": "비도 없는데 갑자기 앞이 뿌옇게 변했다",
    "difficulty": 1,
    "targetAudience": "중학생",
    "estimatedMinutes": 8,
    "event": {
      "date": "2023-03-22",
      "region": "전국",
      "phenomenon": "황사"
    },
    "briefing": "3월 하순의 맑은 날, 오전부터 서울 하늘이 누렇게 변하기 시작했다. 미세먼지(PM10) 농도가 시간당 400㎍/㎥을 넘었고, 아침에는 멀리 산이 보이던 곳도 오후에는 수백 미터 앞도 흐릿해졌다. 비도 오지 않았고, 왜 갑자기 이런 현상이 생겼을까? 관측 자료를 열어 원인을 밝혀라."
  },
  "investigation": {
    "maxInvestigations": 4,
    "clues": [
      {
        "id": "clue-pressure",
        "title": "기압배치",
        "type": "pressure-map",
        "locked": false,
        "cost": 0,
        "summary": "몽골·중국 북부 쪽에 고기압이 자리 잡아 한반도로 북서풍 계열의 바람이 불어오고 있다.",
        "data": {
          "synthetic": true,
          "time": "2023-03-22T09:00",
          "stations": [
            { "stn": 108, "name": "서울", "lat": 37.5714, "lon": 126.9658, "ps": 1012.5 },
            { "stn": 159, "name": "부산", "lat": 35.1040, "lon": 129.0320, "ps": 1010.8 },
            { "stn": 143, "name": "대구", "lat": 35.8851, "lon": 128.6191, "ps": 1011.3 }
          ],
          "note": "북서쪽 고기압에서 한반도 방향으로 기압 경도 형성."
        },
        "interpretationHint": "고기압이 발원지에서 한반도 쪽으로 바람을 밀어낸다. 바람이 어디서 불어오는지가 핵심이다."
      },
      {
        "id": "clue-wind",
        "title": "풍향·풍속",
        "type": "wind",
        "locked": true,
        "cost": 1,
        "summary": "하루 종일 북서풍이 불었다. 중국 내몽골·고비사막 방향에서 불어오는 바람이다.",
        "data": {
          "synthetic": true,
          "stn": 108,
          "name": "서울",
          "points": [
            { "time": "2023-03-22T00:00", "wd": 310, "ws": 4.2 },
            { "time": "2023-03-22T03:00", "wd": 315, "ws": 4.5 },
            { "time": "2023-03-22T06:00", "wd": 320, "ws": 5.1 },
            { "time": "2023-03-22T09:00", "wd": 315, "ws": 5.8 },
            { "time": "2023-03-22T12:00", "wd": 310, "ws": 6.2 },
            { "time": "2023-03-22T15:00", "wd": 305, "ws": 6.0 },
            { "time": "2023-03-22T18:00", "wd": 310, "ws": 5.5 },
            { "time": "2023-03-22T21:00", "wd": 315, "ws": 4.8 }
          ]
        },
        "interpretationHint": "북서풍은 중국 내몽골·고비사막 방향에서 불어오는 바람이다. 발원지에 무엇이 있는지가 황사의 핵심이다."
      },
      {
        "id": "clue-temp",
        "title": "기온과 건조도",
        "type": "temp-comparison",
        "locked": true,
        "cost": 1,
        "summary": "낮 기온은 평년 수준이지만 습도가 20~30%로 매우 건조하다. 발원지에서 건조한 먼지가 쉽게 날린다.",
        "data": {
          "synthetic": true,
          "series": [
            {
              "stn": 108,
              "name": "서울",
              "elevationM": 85,
              "points": [
                { "time": "2023-03-22T00:00", "ta": 4.5 },
                { "time": "2023-03-22T03:00", "ta": 3.2 },
                { "time": "2023-03-22T06:00", "ta": 4.8 },
                { "time": "2023-03-22T09:00", "ta": 9.5 },
                { "time": "2023-03-22T12:00", "ta": 14.2 },
                { "time": "2023-03-22T15:00", "ta": 15.8 },
                { "time": "2023-03-22T18:00", "ta": 12.3 },
                { "time": "2023-03-22T21:00", "ta": 8.1 }
              ]
            }
          ]
        },
        "interpretationHint": "건조한 공기는 먼지가 쉽게 날리고 오래 떠 있을 수 있는 조건이다. 습도가 높으면 먼지 입자가 무거워져 빨리 가라앉는다."
      },
      {
        "id": "clue-mechanism",
        "title": "황사의 이동 경로",
        "type": "text",
        "locked": true,
        "cost": 1,
        "summary": "고비사막·황토 고원에서 북서풍에 의해 모래먼지가 수천 km를 이동해 한반도에 도달한다.",
        "data": {
          "body": "황사는 중국 북부·몽골의 건조한 사막과 황토 지대에서 강한 바람에 의해 모래먼지가 상공으로 날아오를 때 발생한다. 봄철에는 지표가 얼음에서 풀려 건조해지고, 저기압 통과 뒤 북서풍이 강해지면 대량의 모래먼지가 상층 바람을 타고 수천 km를 이동해 한반도에 도달한다. 황사가 오면 PM10 농도가 급증하고 가시거리가 크게 낮아진다."
        },
        "interpretationHint": "발원지(건조 사막·황토) + 강한 북서풍 + 건조한 대기가 황사의 세 요소다."
      }
    ]
  },
  "hypotheses": {
    "prompt": "봄날 갑자기 하늘이 누렇게 변하고 미세먼지가 급증한 가장 큰 원인은?",
    "options": [
      {
        "id": "h-yellow-dust",
        "text": "중국·몽골 사막 지대에서 북서풍에 실려 온 모래먼지(황사)가 한반도에 도달했기 때문이다.",
        "verdict": "correct",
        "requiredClues": ["clue-wind", "clue-pressure"],
        "feedback": "정확하다. 발원지의 건조한 모래 + 북서풍 + 건조한 대기가 황사를 만드는 세 요소다."
      },
      {
        "id": "h-local-pollution",
        "text": "한국 국내 공장과 자동차에서 나온 배기가스가 쌓여 하늘이 뿌옇게 됐다.",
        "verdict": "misconception",
        "requiredClues": ["clue-wind"],
        "feedback": "국내 오염원도 영향을 주지만, 하루 만에 PM10이 수백 ㎍/㎥까지 급등하는 것은 외부 유입 없이는 설명되지 않는다. 풍향을 보면 바람이 어디서 왔는지 알 수 있다."
      },
      {
        "id": "h-pollen",
        "text": "봄철이라 꽃가루가 대량으로 날려서 하늘이 뿌옇게 된 것이다.",
        "verdict": "misconception",
        "requiredClues": [],
        "feedback": "꽃가루도 봄철 미세먼지에 기여하지만, PM10이 폭발적으로 높아지고 황토색을 띠는 것은 황사의 특징이다. 꽃가루만으로는 이 정도 농도를 설명할 수 없다."
      }
    ]
  },
  "solution": {
    "mechanism": "봄철 중국·몽골 사막과 황토 고원은 지표가 건조하게 녹아 모래먼지가 쉽게 날린다. 북서쪽 고기압이 형성되면 강한 북서풍이 이 먼지를 상공으로 올려 수천 km를 이동시킨다. 건조한 대기 속에서 먼지 입자는 쉽게 날아오르고 오래 떠 있어, 한반도에 도달하면 하늘이 노랗고 시정이 나빠지며 PM10 농도가 급증한다.",
    "causalChain": [
      "봄철 중국·몽골 사막 지대의 건조한 지표 노출",
      "북서쪽 고기압 형성 → 강한 북서풍 유발",
      "모래먼지 상공으로 부양, 수천 km 이동",
      "한반도 도달 → PM10 급증, 시정 악화, 황갈색 하늘"
    ],
    "keyFactors": ["발원지(건조 사막·황토)", "북서풍", "대기 건조도", "봄철 계절 조건"]
  },
  "misconceptions": [
    {
      "id": "m-local",
      "trigger": "국내 공장·자동차 배기가스 때문이다.",
      "correction": "국내 배출원도 영향을 주지만, 하루 만에 PM10이 400㎍/㎥ 이상 급등하는 것은 외부(중국·몽골)에서의 대규모 유입 없이는 설명되지 않는다."
    },
    {
      "id": "m-season",
      "trigger": "봄이라 꽃가루가 날려서 뿌옇게 됐다.",
      "correction": "꽃가루도 봄철 미세먼지에 기여하지만, 황사는 광물성 모래 입자다. PM10이 폭발적으로 높아지고 황토색을 띠는 것은 황사의 특징이다."
    }
  ],
  "aiTutor": {
    "systemContext": "정답: 중국·몽골 사막에서 북서풍에 실린 모래먼지(황사)가 한반도에 도달. 핵심 단서는 풍향(북서풍)과 기압배치(북서쪽 고기압). 흔한 오개념은 (1) 국내 오염 (2) 꽃가루.",
    "rules": [
      "정답을 직접 말하지 말 것.",
      "풍향과 발원지 방향의 연관성을 질문으로 유도할 것.",
      "오개념(국내 오염/꽃가루)을 감지하면 풍향을 다시 보도록 유도할 것.",
      "출력은 지정 JSON 형식만 사용할 것."
    ],
    "hintLadder": [
      "오늘 바람이 어느 방향에서 불어왔지? 그 방향으로 계속 가면 어떤 지형이 있을까?",
      "봄철에 모래가 쉽게 날리려면 땅이 어떤 상태여야 할까? 건조한 사막이 발원지가 될 수 있을까?",
      "황토색 먼지가 수천 km를 이동하려면 어떤 조건이 필요할까? 바람의 방향과 세기를 다시 보자."
    ]
  },
  "learning": {
    "concepts": ["황사(Asian dust)", "발원지와 이동 경로", "북서풍", "봄철 기상 패턴"],
    "summary": "황사는 중국·몽골의 건조 사막에서 봄철 북서풍에 실려 한반도로 이동하는 모래먼지다. 발원지의 건조한 조건, 강한 북서풍, 건조한 대기가 세 요소다. 봄철에 자주 발생하는 이유는 이 시기에 발원지 지표가 건조하게 녹아 먼지가 쉽게 날리기 때문이다.",
    "curriculumLink": "중학교 과학 - 기권과 날씨 / 우리나라 날씨 특성"
  },
  "dataSources": [
    {
      "name": "종관기상관측(ASOS) 시간자료 - 서울",
      "portal": "data.kma.go.kr",
      "retrieved": "",
      "note": "합성 예시 데이터."
    }
  ]
}
