{
  "id": "case-11-spring-thunderstorm",
  "version": "0.1.0",
  "dataStatus": "placeholder",
  "meta": {
    "title": "맑던 봄 오후에 갑자기 천둥번개?",
    "subtitle": "아침엔 맑았는데 오후에 소나기와 우레",
    "difficulty": 2,
    "targetAudience": "중학생",
    "estimatedMinutes": 9,
    "event": {
      "date": "2023-05-18",
      "region": "경기·충청 내륙",
      "phenomenon": "봄철 내륙 열대류 뇌우"
    },
    "briefing": "5월 중순의 맑은 날 오후, 갑자기 하늘이 어두워지더니 천둥·번개와 함께 소나기가 쏟아졌다. 오전 내내 맑고 따뜻한 날씨였는데, 왜 오후에 갑자기 뇌우가 발생했을까? 관측 자료를 열어 원인을 밝혀라."
  },
  "investigation": {
    "maxInvestigations": 4,
    "clues": [
      {
        "id": "clue-temp",
        "title": "낮 기온 변화",
        "type": "temp-comparison",
        "locked": false,
        "cost": 0,
        "summary": "오전부터 기온이 빠르게 올라 오후 2시경 31도에 도달했다. 지표가 강하게 가열됐다.",
        "data": {
          "synthetic": true,
          "series": [
            {
              "stn": 119,
              "name": "수원(내륙)",
              "elevationM": 34,
              "points": [
                { "time": "2023-05-18T06:00", "ta": 14.2 },
                { "time": "2023-05-18T07:00", "ta": 16.5 },
                { "time": "2023-05-18T08:00", "ta": 18.8 },
                { "time": "2023-05-18T09:00", "ta": 21.3 },
                { "time": "2023-05-18T10:00", "ta": 23.9 },
                { "time": "2023-05-18T11:00", "ta": 26.2 },
                { "time": "2023-05-18T12:00", "ta": 28.4 },
                { "time": "2023-05-18T13:00", "ta": 30.1 },
                { "time": "2023-05-18T14:00", "ta": 31.0 },
                { "time": "2023-05-18T15:00", "ta": 30.5 },
                { "time": "2023-05-18T16:00", "ta": 27.8 },
                { "time": "2023-05-18T17:00", "ta": 24.3 },
                { "time": "2023-05-18T18:00", "ta": 21.5 }
              ]
            }
          ]
        },
        "interpretationHint": "오후에 기온이 급격히 떨어진 건 소나기가 내리면서 증발 냉각이 일어난 것이다. 오후 2시까지 기온이 계속 올라간 것이 뇌우 발생 전 지표 가열이다."
      },
      {
        "id": "clue-upper-air",
        "title": "상층과 지표 기온차",
        "type": "upper-air",
        "locked": true,
        "cost": 1,
        "summary": "지표는 30도를 넘는데 상공 3km는 영하 5도다. 위아래 기온차가 35도 이상으로 대기가 극도로 불안정하다.",
        "data": {
          "synthetic": true,
          "stn": 119,
          "name": "수원(레윈존데)",
          "time": "2023-05-18T12:00",
          "levels": [
            { "pressureHpa": 1000, "heightM": 50, "ta": 29.5 },
            { "pressureHpa": 925, "heightM": 760, "ta": 21.0 },
            { "pressureHpa": 850, "heightM": 1490, "ta": 13.5 },
            { "pressureHpa": 700, "heightM": 3050, "ta": -4.8 },
            { "pressureHpa": 500, "heightM": 5760, "ta": -19.2 }
          ]
        },
        "interpretationHint": "지표는 따뜻하고 상층은 차면 대기가 불안정해진다. 따뜻한 공기 덩어리가 가벼워져 강하게 상승하고, 이것이 뇌우의 씨앗이 된다."
      },
      {
        "id": "clue-pressure",
        "title": "기압배치와 수렴",
        "type": "pressure-map",
        "locked": true,
        "cost": 1,
        "summary": "약한 저기압이 내륙에 자리 잡아 지표에서 바람이 수렴(모여드는) 하고 있다.",
        "data": {
          "synthetic": true,
          "time": "2023-05-18T12:00",
          "stations": [
            { "stn": 108, "name": "서울", "lat": 37.5714, "lon": 126.9658, "ps": 1006.5 },
            { "stn": 119, "name": "수원", "lat": 37.2636, "lon": 127.0286, "ps": 1005.8 },
            { "stn": 133, "name": "대전", "lat": 36.3720, "lon": 127.3740, "ps": 1006.2 },
            { "stn": 143, "name": "대구", "lat": 35.8851, "lon": 128.6191, "ps": 1008.3 }
          ],
          "note": "내륙 저기압 중심 부근 수렴 강화."
        },
        "interpretationHint": "저기압 중심 부근에서 지표 바람이 모여들면(수렴) 공기가 상승하기 쉬워진다. 이것이 뇌우 발달의 방아쇠가 된다."
      },
      {
        "id": "clue-mechanism",
        "title": "열대류 뇌우 원리",
        "type": "text",
        "locked": true,
        "cost": 1,
        "summary": "맑은 날 강한 일사로 지표가 데워지면 따뜻한 공기 덩어리가 솟구쳐 적란운(뇌우 구름)이 발달한다.",
        "data": {
          "body": "봄·여름 맑은 날 오후, 강한 햇빛이 지표를 가열하면 지표 부근 공기가 주변보다 따뜻해져 가벼워지고 위로 솟구친다(대류). 상층 공기가 차갑고 지표가 뜨거울수록 대기 불안정도(CAPE)가 높아져 공기가 더 강하게 상승한다. 상승하는 공기 속 수증기가 응결되며 적란운이 발달하고, 그 안에서 얼음 입자들이 충돌하며 전기가 쌓여 천둥·번개가 친다. 이를 '열대류 뇌우' 또는 '기단 뇌우'라고 한다. 주로 오후에 발생하고 수십 분~1시간 정도 짧게 지속되다 소멸한다."
        },
        "interpretationHint": "지표 가열(강한 일사) + 대기 불안정(상층 한기) + 수렴이 뇌우의 세 재료다."
      }
    ]
  },
  "hypotheses": {
    "prompt": "맑던 봄 오후에 갑자기 천둥·번개와 소나기가 발생한 가장 큰 원인은?",
    "options": [
      {
        "id": "h-thermal-convection",
        "text": "강한 햇빛으로 지표가 뜨겁게 달궈지고, 상층 대기는 차가워 대기가 불안정해지면서 강한 상승 기류가 발달해 적란운이 형성됐다.",
        "verdict": "correct",
        "requiredClues": ["clue-temp", "clue-upper-air"],
        "feedback": "정확하다. 지표 가열 + 상층 한기 = 대기 불안정이 열대류 뇌우의 핵심이다."
      },
      {
        "id": "h-cold-front",
        "text": "한랭 전선이 통과하면서 찬 공기가 따뜻한 공기 밑으로 파고들어 강제로 상승시켰다.",
        "verdict": "misconception",
        "requiredClues": ["clue-pressure"],
        "feedback": "기압 배치를 보면 전선의 증거가 없다. 이 뇌우는 전선 통과가 아니라 맑은 날 지표 가열로 인한 열대류(기단 뇌우) 타입이다."
      },
      {
        "id": "h-mountains",
        "text": "산에서 불어온 차가운 공기가 따뜻한 평지 공기와 충돌해 구름이 만들어졌다.",
        "verdict": "misconception",
        "requiredClues": ["clue-upper-air"],
        "feedback": "산지와 평지의 바람 충돌이 뇌우를 만들 수 있지만, 이 사례에서 핵심은 지표 가열로 인한 대류다. 지표와 상층의 기온 차이를 먼저 보자."
      }
    ]
  },
  "solution": {
    "mechanism": "5월의 강한 햇빛이 지표를 31도까지 가열했다. 반면 상층(3km)은 영하 5도로 차가워 지표-상층 간 기온 차가 35도 이상이었다. 이렇게 대기 불안정도가 높아진 상태에서 지표의 뜨거운 공기가 강하게 솟구쳐 적란운이 발달했고, 천둥·번개와 소나기가 발생했다. 오후에만 발생한 것은 지표가 가장 많이 가열되는 시간대와 일치한다.",
    "causalChain": [
      "강한 봄철 일사 → 지표 기온 31도까지 상승",
      "상층(3km)은 영하 5도로 차가운 상태 유지",
      "하층 뜨겁고 상층 차가워 대기 불안정 최고조",
      "강한 상승 기류 → 적란운 발달 → 뇌우·소나기"
    ],
    "keyFactors": ["지표 가열(강한 일사)", "대기 불안정(상층 한기)", "열대류(CAPE)", "오후 발생 특성"]
  },
  "misconceptions": [
    {
      "id": "m-cold-front",
      "trigger": "갑자기 비가 온 건 전선이 지나갔기 때문이다.",
      "correction": "전선에 의한 비는 전선이 이동하는 넓은 지역에 걸쳐 내린다. 이 사례는 맑은 날 지표 가열로 인한 열대류 뇌우로, 국지적으로 오후에만 짧게 발생하는 것이 특징이다."
    },
    {
      "id": "m-spring-unstable",
      "trigger": "봄이라 날씨가 변덕스러운 건 당연하다.",
      "correction": "봄 날씨가 변덕스러운 이유가 바로 이것이다. 강한 일사로 지표가 쉽게 과열되고, 겨울 잔재인 차가운 상층 공기와 만나 대기가 불안정해지기 쉽다."
    }
  ],
  "aiTutor": {
    "systemContext": "정답: 강한 일사로 지표 가열(31도) + 상층 한기(영하 5도) = 대기 불안정 → 열대류 뇌우. 핵심 단서는 오후 기온 급상승과 상층-지표 기온 차이. 흔한 오개념은 (1) 한랭 전선 통과 (2) 봄 변덕 날씨를 막연히 원인으로.",
    "rules": [
      "정답을 직접 말하지 말 것.",
      "지표 기온이 언제 가장 높아지는지, 그 시간대와 뇌우 발생 시각의 관계를 질문으로 유도할 것.",
      "상층과 지표 기온 차이(대기 불안정)를 뇌우의 에너지원으로 연결하도록 할 것.",
      "출력은 지정 JSON 형식만 사용할 것."
    ],
    "hintLadder": [
      "뇌우가 오전이 아니라 오후에 발생한 이유는 뭘까? 오후 2시 기온과 아침 기온을 비교해 봐.",
      "지표는 30도인데 상공 3km는 영하야. 따뜻하고 가벼운 공기 덩어리가 차가운 상층을 만나면 어떻게 될까?",
      "공기가 강하게 상승하면 구름이 어떻게 발달할까? 적란운 안에서는 왜 번개가 칠까?"
    ]
  },
  "learning": {
    "concepts": ["대기 불안정", "열대류(CAPE)", "적란운", "기단 뇌우 vs 전선 뇌우"],
    "summary": "봄·여름 오후에 지표가 강하게 가열되고 상층이 차가우면 대기가 불안정해져 열대류 뇌우가 발생한다. 뇌우는 보통 오후 2~5시에 발생하고 수십 분 만에 사라진다. 같은 날 아침 날씨가 맑다고 오후에도 맑으리라는 보장이 없는 이유다.",
    "curriculumLink": "중학교 과학 - 기권과 날씨 / 대기 중의 전기"
  },
  "dataSources": [
    {
      "name": "종관기상관측(ASOS) 시간자료 - 수원",
      "portal": "data.kma.go.kr",
      "retrieved": "",
      "note": "합성 예시 데이터."
    }
  ]
}
